{
  "$schema": "../schema/v1/metrics.schema.json",
  "schemaVersion": "1.0.0",
  "kind": "engineering-evidence/metrics",
  "project": {
    "id": "coktail",
    "name": "Cocktail Cabinet",
    "repository": "https://github.com/MrDrah/coktail"
  },
  "milestone": {
    "id": "mvp",
    "packageId": "mvp",
    "label": "MVP",
    "date": "2026-10-24",
    "revision": 1,
    "supersedes": null
  },
  "framework": {
    "name": "app-boilerplate",
    "version": "0.4.0"
  },
  "source": {
    "commit": "217726c856a92260aa02fae7748edd06fbd2af73",
    "committedAt": "2026-10-24T11:58:13+09:00",
    "ref": null,
    "clean": true
  },
  "collectedAt": "2026-10-24T03:00:53.426Z",
  "collector": {
    "tool": "app-boilerplate/evidence.mjs",
    "version": "0.4.0"
  },
  "window": {
    "from": null,
    "to": "2026-10-24T03:00:53.426Z"
  },
  "metrics": {
    "functional": {
      "status": "PASS",
      "denominator": "stories",
      "criteriaTotal": {
        "value": 38,
        "unit": "count",
        "basis": "measured",
        "method": "distinct criteria in docs/ba/user-stories.md",
        "sources": [
          "stories"
        ]
      },
      "criteriaPassing": {
        "value": 38,
        "unit": "count",
        "basis": "measured",
        "method": "criteria (stories) from docs/ba/user-stories.md with status PASS; a criterion passes only when ≥1 executed JUnit test names its ID and none fails",
        "sources": [
          "stories",
          "junit",
          "junit-2"
        ]
      },
      "criteriaFailing": {
        "value": 0,
        "unit": "count",
        "basis": "measured",
        "method": "criteria (stories) from docs/ba/user-stories.md with ≥1 failing test; a criterion passes only when ≥1 executed JUnit test names its ID and none fails",
        "sources": [
          "stories",
          "junit",
          "junit-2"
        ]
      },
      "criteriaUnverified": {
        "value": 0,
        "unit": "count",
        "basis": "measured",
        "method": "criteria (stories) from docs/ba/user-stories.md with no executed test; a criterion passes only when ≥1 executed JUnit test names its ID and none fails",
        "sources": [
          "stories",
          "junit",
          "junit-2"
        ]
      },
      "criteriaDeferred": {
        "value": 0,
        "unit": "count",
        "basis": "measured",
        "method": "criteria (stories) from docs/ba/user-stories.md deferred in quality-gate.json → trace.allowUntested; a criterion passes only when ≥1 executed JUnit test names its ID and none fails",
        "sources": [
          "stories",
          "junit",
          "junit-2"
        ]
      },
      "testsPassed": {
        "value": 468,
        "unit": "count",
        "basis": "measured",
        "method": "JUnit test cases naming ≥1 criterion that passed",
        "sources": [
          "junit",
          "junit-2"
        ]
      },
      "testsFailed": {
        "value": 0,
        "unit": "count",
        "basis": "measured",
        "method": "JUnit test cases naming ≥1 criterion that failed",
        "sources": [
          "junit",
          "junit-2"
        ]
      },
      "completionPercent": {
        "value": 100,
        "unit": "percent",
        "basis": "measured",
        "method": "criteriaPassing / criteriaTotal × 100 (deferred and unverified criteria count as not complete)",
        "sources": [
          "stories",
          "junit",
          "junit-2"
        ]
      },
      "criteria": [
        {
          "id": "US-E1-01",
          "status": "PASS",
          "passed": 1,
          "failed": 0
        },
        {
          "id": "US-E1-02",
          "status": "PASS",
          "passed": 2,
          "failed": 0
        },
        {
          "id": "US-E1-03",
          "status": "PASS",
          "passed": 8,
          "failed": 0
        },
        {
          "id": "US-E1-04",
          "status": "PASS",
          "passed": 7,
          "failed": 0
        },
        {
          "id": "US-E1-05",
          "status": "PASS",
          "passed": 14,
          "failed": 0
        },
        {
          "id": "US-E1-06",
          "status": "PASS",
          "passed": 13,
          "failed": 0
        },
        {
          "id": "US-E1-07",
          "status": "PASS",
          "passed": 3,
          "failed": 0
        },
        {
          "id": "US-E2-01",
          "status": "PASS",
          "passed": 28,
          "failed": 0
        },
        {
          "id": "US-E2-02",
          "status": "PASS",
          "passed": 7,
          "failed": 0
        },
        {
          "id": "US-E2-03",
          "status": "PASS",
          "passed": 13,
          "failed": 0
        },
        {
          "id": "US-E2-04",
          "status": "PASS",
          "passed": 11,
          "failed": 0
        },
        {
          "id": "US-E2-05",
          "status": "PASS",
          "passed": 1,
          "failed": 0
        },
        {
          "id": "US-E3-01",
          "status": "PASS",
          "passed": 1,
          "failed": 0
        },
        {
          "id": "US-E3-02",
          "status": "PASS",
          "passed": 5,
          "failed": 0
        },
        {
          "id": "US-E3-03",
          "status": "PASS",
          "passed": 1,
          "failed": 0
        },
        {
          "id": "US-E3-04",
          "status": "PASS",
          "passed": 2,
          "failed": 0
        },
        {
          "id": "US-E3-05",
          "status": "PASS",
          "passed": 2,
          "failed": 0
        },
        {
          "id": "US-E3-06",
          "status": "PASS",
          "passed": 2,
          "failed": 0
        },
        {
          "id": "US-E3-07",
          "status": "PASS",
          "passed": 4,
          "failed": 0
        },
        {
          "id": "US-E4-01",
          "status": "PASS",
          "passed": 9,
          "failed": 0
        },
        {
          "id": "US-E4-02",
          "status": "PASS",
          "passed": 1,
          "failed": 0
        },
        {
          "id": "US-E4-03",
          "status": "PASS",
          "passed": 2,
          "failed": 0
        },
        {
          "id": "US-E4-04",
          "status": "PASS",
          "passed": 1,
          "failed": 0
        },
        {
          "id": "US-E4-05",
          "status": "PASS",
          "passed": 2,
          "failed": 0
        },
        {
          "id": "US-E5-01",
          "status": "PASS",
          "passed": 2,
          "failed": 0
        },
        {
          "id": "US-E5-02",
          "status": "PASS",
          "passed": 9,
          "failed": 0
        },
        {
          "id": "US-E5-03",
          "status": "PASS",
          "passed": 2,
          "failed": 0
        },
        {
          "id": "US-E6-01",
          "status": "PASS",
          "passed": 2,
          "failed": 0
        },
        {
          "id": "US-E6-02",
          "status": "PASS",
          "passed": 3,
          "failed": 0
        },
        {
          "id": "US-E6-03",
          "status": "PASS",
          "passed": 2,
          "failed": 0
        },
        {
          "id": "US-E6-04",
          "status": "PASS",
          "passed": 5,
          "failed": 0
        },
        {
          "id": "US-E6-06",
          "status": "PASS",
          "passed": 4,
          "failed": 0
        },
        {
          "id": "US-E6-05",
          "status": "PASS",
          "passed": 4,
          "failed": 0
        },
        {
          "id": "US-NF-01",
          "status": "PASS",
          "passed": 2,
          "failed": 0
        },
        {
          "id": "US-NF-02",
          "status": "PASS",
          "passed": 1,
          "failed": 0
        },
        {
          "id": "US-NF-03",
          "status": "PASS",
          "passed": 1,
          "failed": 0
        },
        {
          "id": "US-NF-04",
          "status": "PASS",
          "passed": 2,
          "failed": 0
        },
        {
          "id": "US-NF-05",
          "status": "PASS",
          "passed": 300,
          "failed": 0
        }
      ]
    },
    "intervention": {
      "status": "PASS",
      "total": {
        "value": 2,
        "unit": "count",
        "basis": "recorded",
        "method": "intervention events in the window",
        "sources": [
          "events"
        ]
      },
      "corrective": {
        "value": 1,
        "unit": "count",
        "basis": "recorded",
        "method": "technical-correction + agent-failure + manual-implementation events",
        "sources": [
          "events"
        ]
      },
      "byType": {
        "product-decision": {
          "value": 0,
          "unit": "count",
          "basis": "recorded",
          "method": "\"product-decision\" events in the window",
          "sources": [
            "events"
          ]
        },
        "approval": {
          "value": 1,
          "unit": "count",
          "basis": "recorded",
          "method": "\"approval\" events in the window",
          "sources": [
            "events"
          ]
        },
        "technical-correction": {
          "value": 0,
          "unit": "count",
          "basis": "recorded",
          "method": "\"technical-correction\" events in the window",
          "sources": [
            "events"
          ]
        },
        "agent-failure": {
          "value": 0,
          "unit": "count",
          "basis": "recorded",
          "method": "\"agent-failure\" events in the window",
          "sources": [
            "events"
          ]
        },
        "manual-implementation": {
          "value": 1,
          "unit": "count",
          "basis": "recorded",
          "method": "\"manual-implementation\" events in the window",
          "sources": [
            "events"
          ]
        }
      },
      "agentTasks": {
        "value": 0,
        "unit": "count",
        "basis": "recorded",